{
  "schema_version": "0.3.0",
  "artifact_type": "semantic_analysis",
  "artifact_id": "semantic_compatibility_001",
  "run_id": "run_compatibility_001",
  "iteration": 0,
  "producer": "semantic_analyzer",
  "mode": "development",
  "created_at": "2026-10-07T00:00:00Z",
  "status": "completed",
  "input_refs": [
    {
      "artifact_id": "crawl_compatibility_001",
      "artifact_type": "crawl_result",
      "iteration": 0,
      "path": "artifacts/iteration-000/collector/crawl_result.json",
      "sha256": "aaaaaaaaaaaaaaaaaaaaaaaaaaaaaaaaaaaaaaaaaaaaaaaaaaaaaaaaaaaaaaaa"
    }
  ],
  "errors": [],
  "runtime_metrics": null,
  "data": {
    "normalized_requests": [
      {
        "request_id": "request_order_alice",
        "endpoint_id": "endpoint:GET:/orders/{id}",
        "method": "GET",
        "path_template": "/orders/{id}",
        "account_id": "acc_alice",
        "role_id": "role_user",
        "action_meaning": "read_order",
        "resource_ids": [
          "resource:order"
        ],
        "parameters": [
          {
            "parameter_id": "param:endpoint:GET:/orders/{id}:path:id",
            "name": "id",
            "location": "path",
            "value_type": "string",
            "is_sensitive": false
          }
        ],
        "basis": "observed",
        "evidence_refs": []
      }
    ],
    "nodes": [
      {
        "node_id": "user:acc_alice",
        "node_type": "User",
        "properties": {
          "account_id": "acc_alice",
          "alias": "alice",
          "role_id": "role_user"
        },
        "basis": "observed",
        "evidence_refs": []
      },
      {
        "node_id": "role:role_user",
        "node_type": "Role",
        "properties": {
          "name": "user",
          "role_id": "role_user"
        },
        "basis": "observed",
        "evidence_refs": []
      },
      {
        "node_id": "endpoint:GET:/orders/{id}",
        "node_type": "Endpoint",
        "properties": {
          "method": "GET",
          "path_template": "/orders/{id}"
        },
        "basis": "observed",
        "evidence_refs": []
      },
      {
        "node_id": "param:endpoint:GET:/orders/{id}:path:id",
        "node_type": "Parameter",
        "properties": {
          "name": "id",
          "location": "path",
          "value_type": "string",
          "is_sensitive": false
        },
        "basis": "observed",
        "evidence_refs": []
      },
      {
        "node_id": "resource:order",
        "node_type": "Resource",
        "properties": {
          "resource_key": "order",
          "resource_scope": "instance",
          "match_key": {
            "resource_key": "order",
            "identifiers": [
              {
                "key": "order_id",
                "value": "example-order"
              }
            ]
          }
        },
        "basis": "inferred",
        "evidence_refs": []
      }
    ],
    "relationships": [
      {
        "relationship_id": "rel:user:acc_alice|HAS_ROLE|role:role_user",
        "source_id": "user:acc_alice",
        "target_id": "role:role_user",
        "relation_type": "HAS_ROLE",
        "properties": {},
        "basis": "observed",
        "evidence_refs": []
      },
      {
        "relationship_id": "rel:role:role_user|ACCESS|endpoint:GET:/orders/{id}",
        "source_id": "role:role_user",
        "target_id": "endpoint:GET:/orders/{id}",
        "relation_type": "ACCESS",
        "properties": {},
        "basis": "observed",
        "evidence_refs": []
      },
      {
        "relationship_id": "rel:user:acc_alice|ACCESS|endpoint:GET:/orders/{id}",
        "source_id": "user:acc_alice",
        "target_id": "endpoint:GET:/orders/{id}",
        "relation_type": "ACCESS",
        "properties": {},
        "basis": "observed",
        "evidence_refs": []
      },
      {
        "relationship_id": "rel:endpoint:GET:/orders/{id}|USE|param:endpoint:GET:/orders/{id}:path:id",
        "source_id": "endpoint:GET:/orders/{id}",
        "target_id": "param:endpoint:GET:/orders/{id}:path:id",
        "relation_type": "USE",
        "properties": {},
        "basis": "observed",
        "evidence_refs": []
      },
      {
        "relationship_id": "rel:endpoint:GET:/orders/{id}|REFERENCE|resource:order",
        "source_id": "endpoint:GET:/orders/{id}",
        "target_id": "resource:order",
        "relation_type": "REFERENCE",
        "properties": {},
        "basis": "inferred",
        "evidence_refs": []
      },
      {
        "relationship_id": "rel:user:acc_alice|OWNS|resource:order",
        "source_id": "user:acc_alice",
        "target_id": "resource:order",
        "relation_type": "OWNS",
        "properties": {},
        "basis": "inferred",
        "evidence_refs": []
      }
    ],
    "workflows": [
      {
        "workflow_id": "workflow:acc_alice",
        "name": "observed_flow_acc_alice",
        "role_ids": [
          "role_user"
        ],
        "steps": [
          {
            "step_id": "step:acc_alice:0",
            "order": 0,
            "action": "read_order",
            "request_ids": [
              "request_order_alice"
            ]
          }
        ],
        "dependencies": [],
        "basis": "inferred",
        "evidence_refs": []
      }
    ],
    "model_info": null
  }
}
